{
  "id": "mitchell_advice_protection_cover",
  "category": "01-query-types",
  "persona": "peak_earners",
  "is_mutating": false,
  "description": "David Mitchell asks about protection cover. Classifier resolves to PROTECTION_COVER (primary), modules: [protection]. Universal KYC passes (full peak_earners seed). ProtectionAgent finds protection_profile + life + critical illness + income protection policies all populated -- happy path across all 3 protection types. LLM should reference specific policies and signpost FCA advice.",
  "input": {
    "turns": [
      {"user": "Am I covered enough for protection?", "current_route": "/protection"}
    ]
  },
  "expected_classification_shape": {
    "primary": "protection_cover",
    "related": [],
    "modules": ["protection"]
  },
  "expected_response_mode": "recommendation",
  "expected_engine_call_level": "module",
  "expected_kyc_state": "passed",
  "expected_tool_calls": [
    {"tool": "list_records", "args": {"entity_type": "life_insurance"}, "required": true, "result_path": "happy"},
    {"tool": "list_records", "args": {"entity_type": "critical_illness"}, "required": true, "result_path": "happy"},
    {"tool": "list_records", "args": {"entity_type": "income_protection"}, "required": true, "result_path": "happy"},
    {"tool": "get_module_analysis", "args": {"module": "protection"}, "required": true, "result_path": "happy"}
  ],
  "expected_tool_calls_absent": [
    "create_protection_policy",
    "update_protection_policy",
    "delete_record",
    "delegate_to_capture",
    "navigate_to_page"
  ],
  "expected_sse_events": {
    "must_contain_types": ["title", "content", "tool_use", "done"],
    "must_emit_exactly_once": ["done", "title"],
    "must_not_emit": ["persona_state_change", "handoff", "consent_required", "error"],
    "content_event_minimum": 5,
    "tool_use_count_min": 4,
    "tool_use_count_max": 12
  },
  "expected_assistant_text": {
    "must_contain_substrings": [
      "For regulated advice personal to your circumstances, speak to a qualified financial adviser."
    ],
    "must_contain_at_least_one_of": [
      ["life", "critical illness", "income protection"]
    ],
    "must_not_contain_substrings": ["I think you should", "I'd recommend", "In my opinion", "you should definitely"],
    "minimum_length_chars": 200,
    "maximum_length_chars": 3000
  },
  "expected_db_writes": {
    "expected_count": 0,
    "expected_no_writes_to": ["life_insurance_policies", "critical_illness_policies", "income_protection_policies", "users", "protection_profiles"]
  },
  "expected_engine_trace": {
    "must_contain": [
      {"event": "AgentDecision", "decisionPoint": "classify_query"},
      {"event": "AgentDecision", "decisionPoint": "response_mode", "outcome": "recommendation"},
      {"event": "AgentDecision", "decisionPoint": "engine_call_level", "outcome": "module"},
      {"event": "GateChecked", "gate": "kyc", "module": "global", "passed": true},
      {"event": "GateChecked", "gate": "kyc", "module": "protection", "passed": true},
      {"event": "EngineCalled", "engine": "protection_analysis"}
    ],
    "must_not_contain": [
      {"event": "EngineCalled", "engine": "orchestrate_analysis"}
    ]
  },
  "expected_http_log": {
    "calls": 4,
    "must_have_status_200": ["login", "create_conversation", "send_message", "logout"]
  },
  "timing_budget_ms": {
    "anthropic": {"happy": 9000},
    "xai": {"happy": 22000}
  },
  "tags": ["regression-band-0", "recommendation-mode", "protection", "peak_earners", "happy-path"]
}
